{
  "strike_id": "GAZA-2024-000119",
  "date": "2025-05-17",
  "time": "03:43",
  "latitude": 31.546313717239467,
  "longitude": 34.44626825320192,
  "munition": "airstrike",
  "confidence": 0.45743641410642166,
  "verification": "reported",
  "facility_type": "residential",
  "destroyed_buildings": 6,
  "hospital_damage": false,
  "school_damage": false,
  "casualties_reported": 3,
  "description": "Reported strike in Beach Camp area — pending verification",
  "sources": [
    {
      "name": "OCHA oPt Daily Report",
      "url": "https://www.ochaopt.org/",
      "type": "un"
    }
  ]
}