{
  "strike_id": "GAZA-2024-000115",
  "date": "2024-06-28",
  "time": "07:16",
  "latitude": 31.524281992023347,
  "longitude": 34.44929076566085,
  "munition": "unknown",
  "confidence": 0.626399832663253,
  "verification": "reported",
  "facility_type": "residential",
  "destroyed_buildings": 0,
  "hospital_damage": false,
  "school_damage": false,
  "casualties_reported": 9,
  "description": "Reported strike in Shejaiya area — pending verification",
  "sources": [
    {
      "name": "OCHA oPt Daily Report",
      "url": "https://www.ochaopt.org/",
      "type": "un"
    }
  ]
}