{
  "strike_id": "GAZA-2024-000007",
  "date": "2024-10-14",
  "time": "03:00",
  "latitude": 31.540,
  "longitude": 34.475,
  "munition": "airstrike",
  "confidence": 0.93,
  "verification": "confirmed",
  "facility_type": "hospital",
  "destroyed_buildings": 3,
  "hospital_damage": true,
  "school_damage": false,
  "casualties_reported": 50,
  "description": "Strike on Kamal Adwan Hospital in northern Gaza",
  "sources": [
    { "name": "MSF", "url": "https://www.msf.org/", "type": "ngo" },
    { "name": "Al Jazeera", "url": "https://www.aljazeera.com/", "type": "news" }
  ]
}
